institution,elective,overview,title,summary,content,ilo
VirginiaTech_USA,CS4704,"<h2>VirginiaTech_USA CS4704</h2><h2>title</h2>Software Engineering Capstone<h2>content</h2>Senior project course integrating software engineering knowledge and skills acquired in previous courses. Team-based approach to problem formulation, requirements engineering, architecture, design, implementation, integration, documentation and delivery of a software system that solves a real-world problem.",Software Engineering Capstone,,"Senior project course integrating software engineering knowledge and skills acquired in previous courses. Team-based approach to problem formulation, requirements engineering, architecture, design, implementation, integration, documentation and delivery of a software system that solves a real-world problem.",
VirginiaTech_USA,CS4784,"<h2>VirginiaTech_USA CS4784</h2><h2>title</h2>Human-Computer Interaction Capstone<h2>content</h2>Advanced, project-based course in Human-Computer Interaction. Team-based, end-to-end, integrative interface design project drawn from area of expertise in the department, e.g., virtual reality, augmented reality, embodied cognition, visualization, semiotic engineering, game design, personal information management, mobile computing, design tools, educational technology, and digital democracy. Pre-requisite: Senior Standing required. A grade of C or better is required in CS pre-requisite 3724 and 3744",Human-Computer Interaction Capstone,,"Advanced, project-based course in Human-Computer Interaction. Team-based, end-to-end, integrative interface design project drawn from area of expertise in the department, e.g., virtual reality, augmented reality, embodied cognition, visualization, semiotic engineering, game design, personal information management, mobile computing, design tools, educational technology, and digital democracy. Pre-requisite: Senior Standing required. A grade of C or better is required in CS pre-requisite 3724 and 3744",
VirginiaTech_USA,CS4804,"<h2>VirginiaTech_USA CS4804</h2><h2>title</h2>Introduction to Artificial Intelligence<h2>content</h2>Overview of the areas of problem solving, game playing, and computer vision. Search trees and/or graphs, game trees, block world vision, syntactic pattern recognition, object matching, natural language, and robotics.",Introduction to Artificial Intelligence,,"Overview of the areas of problem solving, game playing, and computer vision. Search trees and/or graphs, game trees, block world vision, syntactic pattern recognition, object matching, natural language, and robotics.",
VirginiaTech_USA,CS4824,"<h2>VirginiaTech_USA CS4824</h2><h2>title</h2>Machine Learning<h2>content</h2>Algorithms and principles involved in machine learning; focus on perception problems arising in computer vision, natural language processing and robotics; fundamentals of representing uncertainty, learning from data, supervised learning, ensemble methods, unsupervised learning, structured models, learning theory and reinforcement learning; design and analysis of machine perception systems; design and implementation of a technical project applied to real-world datasets (images, text, robotics). A grade of C- or better in prerequisites.",Machine Learning,,"Algorithms and principles involved in machine learning; focus on perception problems arising in computer vision, natural language processing and robotics; fundamentals of representing uncertainty, learning from data, supervised learning, ensemble methods, unsupervised learning, structured models, learning theory and reinforcement learning; design and analysis of machine perception systems; design and implementation of a technical project applied to real-world datasets (images, text, robotics). A grade of C- or better in prerequisites.",
VirginiaTech_USA,CS4884,"<h2>VirginiaTech_USA CS4884</h2><h2>title</h2>Computational Biology & Bioinformatics Capstone<h2>content</h2>Advanced topics in computational biology and bioinformatics (CBB). Team-based approach to solving open-ended problems in CBB. Projects drawn from areas of expertise in the department, e.g., algorithms for CBB, computational models for biological systems, analysis of structure-function relationships in biomolecules, genomic data analysis and data mining, computational genomics, systems biology. Design, implementation, documentation and presentation of solutions.",Computational Biology & Bioinformatics Capstone,,"Advanced topics in computational biology and bioinformatics (CBB). Team-based approach to solving open-ended problems in CBB. Projects drawn from areas of expertise in the department, e.g., algorithms for CBB, computational models for biological systems, analysis of structure-function relationships in biomolecules, genomic data analysis and data mining, computational genomics, systems biology. Design, implementation, documentation and presentation of solutions.",
